
{
  "week": 5,
  "path": "alphabet",
  "targetLanguage": "Romanian",
  "nativeLanguage": "Urdu",
  "days": [
    {
      "week": 5,
      "day": 1,
      "letter": "X",
      "title": "پانچواں ہفتہ، پہلا دن: حرف X",
      "title_native": "Săptămâna 5, Ziua 1: Litera X",
      "theme": "آخری حروف",
      "path": "alphabet",
      "targetLanguage": "Romanian",
      "nativeLanguage": "Urdu",
      "words": [
        {
          "id": "ra_5_1_1",
          "target": "Xilofon",
          "phonetic": "کزی-لو-فون",
          "native_meaning": "زائل فون",
          "english": "Xylophone",
          "example_sentence_target": "Cânt la xilofon.",
          "example_sentence_native": "میں زائل فون بجاتا ہوں۔",
          "example_sentence_phonetic": "کنت لا کزی-لو-فون۔"
        }
      ],
      "exercises": {
        "writingPractice": [{ "id": "wra_5_1_1", "letter": "X" }],
        "matching": [{ "id": "mra_5_1_1", "target": "Xilofon", "native": "ساز" }]
      },
      "cultural_note": "'X' کی آواز اکثر 'کس' یا 'گز' جیسی ہوتی ہے۔",
      "pronunciation_tip": "اردو کے 'ک' اور 'س' کو تیزی سے ملا کر ادا کریں۔",
      "progress": { "xp": 50, "streak_bonus": 10, "badge": "ROM-W5D1" }
    },
    {
      "week": 5,
      "day": 2,
      "letter": "Y",
      "title": "پانچواں ہفتہ، دوسرا دن: حرف Y",
      "title_native": "Săptămâna 5, Ziua 2: Litera Y",
      "theme": "غیر ملکی حرف Y",
      "path": "alphabet",
      "targetLanguage": "Romanian",
      "nativeLanguage": "Urdu",
      "words": [
        {
          "id": "ra_5_2_1",
          "target": "Yoga",
          "phonetic": "یو-گا",
          "native_meaning": "یوگا",
          "english": "Yoga",
          "example_sentence_target": "Fac yoga dimineața.",
          "example_sentence_native": "میں صبح یوگا کرتا ہوں۔",
          "example_sentence_phonetic": "فاک یو-گا دِ-می-نیا-تسا۔"
        }
      ],
      "exercises": {
        "writingPractice": [{ "id": "wra_5_2_1", "letter": "Y" }],
        "matching": [{ "id": "mra_5_2_1", "target": "Yoga", "native": "یوگا" }]
      },
      "cultural_note": "حرف 'Y' بھی غیر ملکی الفاظ تک محدود ہے۔",
      "pronunciation_tip": "اسے اکثر 'ای' یا 'ی' کی طرح پڑھا جاتا ہے۔",
      "progress": { "xp": 50, "streak_bonus": 10, "badge": "ROM-W5D2" }
    },
    {
      "week": 5,
      "day": 3,
      "letter": "Z",
      "title": "پانچواں ہفتہ، تیسرا دن: حرف Z",
      "title_native": "Săptămâna 5, Ziua 3: Litera Z",
      "theme": "حرفِ تہجی کا اختتام",
      "path": "alphabet",
      "targetLanguage": "Romanian",
      "nativeLanguage": "Urdu",
      "words": [
        {
          "id": "ra_5_3_1",
          "target": "Zahăr",
          "phonetic": "زا-ہَر",
          "native_meaning": "چینی / شکر",
          "english": "Sugar",
          "example_sentence_target": "Vreau zahăr în cafea.",
          "example_sentence_native": "مجھے کافی میں چینی چاہیے۔",
          "example_sentence_phonetic": "وریاؤ زا-ہَر اِین کا-فیا۔"
        }
      ],
      "exercises": {
        "writingPractice": [{ "id": "wra_5_3_1", "letter": "Z" }],
        "matching": [{ "id": "mra_5_3_1", "target": "Zahăr", "native": "چینی" }]
      },
      "cultural_note": "'Z' کی آواز اردو کے 'ز' (زال، زے، ضاد، ظوئے) جیسی ہے۔",
      "pronunciation_tip": "دانتوں کو جوڑ کر بھنبھناہٹ والی 'زے' کی آواز نکالیں۔",
      "progress": { "xp": 50, "streak_bonus": 10, "badge": "ROM-W5D3" }
    },
    {
      "week": 5,
      "day": 4,
      "letter": "Ce/Ci",
      "title": "پانچواں ہفتہ، چوتھا دن: Ce اور Ci",
      "title_native": "Săptămâna 5, Ziua 4: Ce și Ci",
      "theme": "نرم 'C' کی آواز",
      "path": "alphabet",
      "targetLanguage": "Romanian",
      "nativeLanguage": "Urdu",
      "words": [
        {
          "id": "ra_5_4_1",
          "target": "Cinci",
          "phonetic": "چِینچ",
          "native_meaning": "پانچ (5)",
          "english": "Five",
          "example_sentence_target": "Am cinci mere.",
          "example_sentence_native": "میرے پاس پانچ سیب ہیں۔",
          "example_sentence_phonetic": "آم چِینچ می-رے۔"
        }
      ],
      "exercises": {
        "matching": [{ "id": "mra_5_4_1", "target": "Cinci", "native": "پانچ" }]
      },
      "cultural_note": "یہ ایک بہت اہم اصول ہے: جب 'C' کے بعد 'E' یا 'I' ہو، تو یہ 'چ' کی آواز دیتا ہے۔",
      "pronunciation_tip": "اردو کے حرف 'چ' (چے) کی آواز نکالیں۔",
      "progress": { "xp": 50, "streak_bonus": 10, "badge": "ROM-W5D4" }
    },
    {
      "week": 5,
      "day": 5,
      "letter": "Ge/Gi",
      "title": "پانچواں ہفتہ، پانچواں دن: Ge اور Gi",
      "title_native": "Săptămâna 5, Ziua 5: Ge și Gi",
      "theme": "نرم 'G' کی آواز",
      "path": "alphabet",
      "targetLanguage": "Romanian",
      "nativeLanguage": "Urdu",
      "words": [
        {
          "id": "ra_5_5_1",
          "target": "Gheață",
          "phonetic": "گیا-تسا",
          "native_meaning": "برف",
          "english": "Ice",
          "example_sentence_target": "Vreau apă cu gheață.",
          "example_sentence_native": "مجھے برف والا پانی چاہیے۔",
          "example_sentence_phonetic": "وریاؤ آ-پہ کُو گیا-تسا۔"
        }
      ],
      "exercises": {
        "matching": [{ "id": "mra_5_5_1", "target": "Gheață", "native": "برف" }]
      },
      "cultural_note": "اسی طرح، جب 'G' کے بعد 'E' یا 'I' ہو، تو یہ 'ج' کی آواز دیتا ہے۔",
      "pronunciation_tip": "اردو کے حرف 'ج' (جیم) کی آواز نکالیں۔",
      "progress": { "xp": 50, "streak_bonus": 10, "badge": "ROM-W5D5" }
    },
    {
      "week": 5,
      "day": 6,
      "letter": "Che/Chi",
      "title": "پانچواں ہفتہ، چھٹا دن: Che اور Chi",
      "title_native": "Săptămâna 5, Ziua 6: Che și Chi",
      "theme": "سخت آوازیں",
      "path": "alphabet",
      "targetLanguage": "Romanian",
      "nativeLanguage": "Urdu",
      "words": [
        {
          "id": "ra_5_6_1",
          "target": "Chitara",
          "phonetic": "کی-تا-را",
          "native_meaning": "گٹار",
          "english": "Guitar",
          "example_sentence_target": "Cânt la chitară.",
          "example_sentence_native": "میں گٹار بجاتا ہوں۔",
          "example_sentence_phonetic": "کنت لا کی-تا-رَہ۔"
        }
      ],
      "exercises": {
        "matching": [{ "id": "mra_5_6_1", "target": "Chitara", "native": "گٹار" }]
      },
      "cultural_note": "جب 'C' اور 'E/I' کے درمیان 'H' آ جائے، تو آواز دوبارہ 'ک' ہو جاتی ہے۔",
      "pronunciation_tip": "اسے اردو کے 'ک' (کاف) کی طرح ادا کریں۔ 'ہ' کی آواز نہیں نکالنی۔",
      "progress": { "xp": 50, "streak_bonus": 10, "badge": "ROM-W5D6" }
    },
    {
      "week": 5,
      "day": 7,
      "letter": "Review",
      "title": "پانچواں ہفتہ، ساتواں دن: آخری جائزہ",
      "title_native": "Săptămâna 5, Ziua 7: Recapitulare finală",
      "theme": "آپ نے کر دکھایا!",
      "path": "alphabet",
      "targetLanguage": "Romanian",
      "nativeLanguage": "Urdu",
      "words": [
        {
          "id": "ra_5_7_1",
          "target": "Felicitări",
          "phonetic": "فے-لی-چی-تَہ-ری",
          "native_meaning": "مبارک ہو!",
          "english": "Congratulations",
          "example_sentence_target": "Felicitări pentru succes!",
          "example_sentence_native": "کامیابی پر مبارک ہو!",
          "example_sentence_phonetic": "فے-لی-چی-تَہ-ری پین-ترو سُوک-چیس!"
        }
      ],
      "exercises": {
        "matching": [
          { "id": "mra_5_7_1", "target": "Bună", "native": "سلام" },
          { "id": "mra_5_7_2", "target": "Mulțumesc", "native": "شکریہ" }
        ]
      },
      "cultural_note": "آپ نے رومانیائی حروفِ تہجی مکمل کر لیے ہیں۔ اب آپ رومانیہ میں سائن بورڈ اور مینو پڑھ سکتے ہیں۔",
      "pronunciation_tip": "روزانہ تھوڑی دیر بلند آواز میں پڑھنے کی مشق کریں تاکہ زبان روان ہو جائے۔",
      "progress": { "xp": 100, "streak_bonus": 20, "badge": "ROM-ALPH-COMPLETE" }
    }
  ]
}
