
{
  "week": 4,
  "path": "numbers",
  "targetLanguage": "Spanish",
  "nativeLanguage": "Urdu",
  "days": [
    {
      "week": 4,
      "day": 1,
      "title": "Day 22: Money & Currency",
      "title_native": "دن 22: پیسہ اور کرنسی",
      "theme": "Finances",
      "path": "numbers",
      "targetLanguage": "Spanish",
      "nativeLanguage": "Urdu",
      "words": [
        { "id": "w1", "target": "Dinero", "phonetic": "دینیرو", "native_meaning": "پیسہ", "english": "Money", "example_sentence_target": "Necesito dinero.", "example_sentence_native": "مجھے پیسے چاہئیں۔", "example_sentence_phonetic": "نیتھسیتو دینیرو" },
        { "id": "w2", "target": "Euro", "phonetic": "ایورو", "native_meaning": "یورو", "english": "Euro", "example_sentence_target": "Un euro.", "example_sentence_native": "ایک یورو۔", "example_sentence_phonetic": "اون ایورو" },
        { "id": "w3", "target": "Efectivo", "phonetic": "ایفیکتیوو", "native_meaning": "نقد", "english": "Cash", "example_sentence_target": "Pago en efectivo.", "example_sentence_native": "میں نقد ادائیگی کروں گا۔", "example_sentence_phonetic": "پاگو این ایفیکتیوو" }
      ],
      "exercises": {
        "matching": [
          { "id": "m1", "target": "Dinero", "native": "پیسہ" },
          { "id": "m2", "target": "Efectivo", "native": "نقد" }
        ]
      },
      "cultural_note": "اسپین میں زیادہ تر چھوٹی دکانوں پر نقد رقم کو ترجیح دی جاتی ہے۔",
      "pronunciation_tip": "Stress 'di-NE-ro'.",
      "progress": { "xp": 100, "streak_bonus": 10, "badge": "ESP-NUM-W4D1" }
    },
    {
      "week": 4,
      "day": 2,
      "title": "Day 23: Asking Prices",
      "title_native": "دن 23: قیمت پوچھنا",
      "theme": "Shopping",
      "path": "numbers",
      "targetLanguage": "Spanish",
      "nativeLanguage": "Urdu",
      "words": [
        { "id": "w1", "target": "¿Cuánto cuesta?", "phonetic": "کوانتو کویستا", "native_meaning": "اس کی قیمت کیا ہے؟", "english": "How much does it cost?", "example_sentence_target": "¿Cuánto cuesta esto?", "example_sentence_native": "اس کی قیمت کیا ہے؟", "example_sentence_phonetic": "کوانتو کویستا ایستو" },
        { "id": "w2", "target": "Precio", "phonetic": "پریتھیو", "native_meaning": "قیمت", "english": "Price", "example_sentence_target": "El precio es bajo.", "example_sentence_native": "قیمت کم ہے۔", "example_sentence_phonetic": "ایل پریتھیو ایس باہو" }
      ],
      "exercises": {
        "sentenceScramble": [
          { "id": "s1", "scrambled": ["esto?", "cuesta", "¿Cuánto"], "correct": "¿Cuánto cuesta esto?", "nativeHint": "اس کی قیمت کیا ہے؟" }
        ]
      },
      "cultural_note": "قیمت پوچھنے کے لیے 'کوانتو کویستا' سب سے عام فقرہ ہے۔",
      "pronunciation_tip": "Rise the tone at the end for questions.",
      "progress": { "xp": 100, "streak_bonus": 10, "badge": "ESP-NUM-W4D2" }
    },
    {
      "week": 4,
      "day": 3,
      "title": "Day 24: Telling Time (Hours)",
      "title_native": "دن 24: وقت بتانا (گھنٹے)",
      "theme": "Time",
      "path": "numbers",
      "targetLanguage": "Spanish",
      "nativeLanguage": "Urdu",
      "words": [
        { "id": "w1", "target": "¿Qué hora es?", "phonetic": "کے اورا ایس", "native_meaning": "کیا وقت ہوا ہے؟", "english": "What time is it?", "example_sentence_target": "Perdone, ¿qué hora es?", "example_sentence_native": "معاف کیجیے گا، کیا وقت ہوا ہے؟", "example_sentence_phonetic": "پردونے، کے اورا ایس" },
        { "id": "w2", "target": "Es la una", "phonetic": "ایس لا اونا", "native_meaning": "ایک بجا ہے", "english": "It is one o'clock", "example_sentence_target": "Es la una.", "example_sentence_native": "ایک بجا ہے۔", "example_sentence_phonetic": "ایس لا اونا" },
        { "id": "w3", "target": "Son las dos", "phonetic": "سون لاس دوس", "native_meaning": "دو بجے ہیں", "english": "It is two o'clock", "example_sentence_target": "Son las dos.", "example_sentence_native": "دو بجے ہیں۔", "example_sentence_phonetic": "سون لاس دوس" }
      ],
      "exercises": {
        "matching": [
          { "id": "m1", "target": "¿Qué hora es?", "native": "کیا وقت ہوا ہے؟" },
          { "id": "m2", "target": "Es la una", "native": "1 بجا ہے" }
        ]
      },
      "cultural_note": "صرف 1 بجے کے لیے 'Es la' استعمال ہوتا ہے، باقی گھنٹوں کے لیے 'Son las'۔",
      "pronunciation_tip": "Silent 'H' in 'Hora'.",
      "progress": { "xp": 100, "streak_bonus": 10, "badge": "ESP-NUM-W4D3" }
    },
    {
      "week": 4,
      "day": 4,
      "title": "Day 25: Time (Minutes)",
      "title_native": "دن 25: وقت (منٹ)",
      "theme": "Time",
      "path": "numbers",
      "targetLanguage": "Spanish",
      "nativeLanguage": "Urdu",
      "words": [
        { "id": "w1", "target": "Y cuarto", "phonetic": "ای کواٹرو", "native_meaning": "سوا (پندرہ منٹ اوپر)", "english": "Quarter past", "example_sentence_target": "Las dos y cuarto.", "example_sentence_native": "سوا دو بجے۔", "example_sentence_phonetic": "لاس دوس ای کواٹرو" },
        { "id": "w2", "target": "Y media", "phonetic": "ای میڈیا", "native_meaning": "ساڑھے (آدھا گھنٹہ)", "english": "Half past", "example_sentence_target": "Son las tres y media.", "example_sentence_native": "ساڑھے تین بجے ہیں۔", "example_sentence_phonetic": "سون لاس تریس ای میڈیا" }
      ],
      "exercises": {
        "matching": [
          { "id": "m1", "target": "Y media", "native": "ساڑھے" },
          { "id": "m2", "target": "Y cuarto", "native": "سوا" }
        ]
      },
      "cultural_note": "اسپین میں وقت بتانے کا یہ طریقہ بہت عام ہے۔",
      "pronunciation_tip": "'Y' is pronounced like 'E'.",
      "progress": { "xp": 100, "streak_bonus": 10, "badge": "ESP-NUM-W4D4" }
    },
    {
      "week": 4,
      "day": 5,
      "title": "Day 26: Date Phrases",
      "title_native": "دن 26: تاریخ کے فقرے",
      "theme": "Calendar",
      "path": "numbers",
      "targetLanguage": "Spanish",
      "nativeLanguage": "Urdu",
      "words": [
        { "id": "w1", "target": "Hoy", "phonetic": "اوئے", "native_meaning": "آج", "english": "Today", "example_sentence_target": "Hoy ہے پریمیرو۔", "example_sentence_native": "آج پہلی تاریخ ہے۔", "example_sentence_phonetic": "اوئے ایس پریمیرو" },
        { "id": "w2", "target": "Mañana", "phonetic": "مانیانہ", "native_meaning": "کل", "english": "Tomorrow", "example_sentence_target": "Mañana es lunes.", "example_sentence_native": "کل پیر ہے۔", "example_sentence_phonetic": "مانیانہ ایس لونیس" }
      ],
      "exercises": {
        "matching": [
          { "id": "m1", "target": "Hoy", "native": "آج" },
          { "id": "m2", "target": "Mañana", "native": "کل" }
        ]
      },
      "cultural_note": "'Mañana' کا مطلب 'کل' بھی ہے اور 'صبح' بھی۔",
      "pronunciation_tip": "The 'ñ' sounds like 'ny' in 'onion'.",
      "progress": { "xp": 100, "streak_bonus": 10, "badge": "ESP-NUM-W4D5" }
    },
    {
      "week": 4,
      "day": 6,
      "title": "Day 27: Shopping Review",
      "title_native": "دن 27: خریداری کی دہرائی",
      "theme": "Review",
      "path": "numbers",
      "targetLanguage": "Spanish",
      "nativeLanguage": "Urdu",
      "words": [
        { "id": "r1", "target": "Barato", "phonetic": "باراتو", "native_meaning": "سستا", "english": "Cheap", "example_sentence_target": "Es muy barato.", "example_sentence_native": "یہ بہت سستا ہے۔", "example_sentence_phonetic": "ایس موئی باراتو" },
        { "id": "r2", "target": "Caro", "phonetic": "کارو", "native_meaning": "مہنگا", "english": "Expensive", "example_sentence_target": "Es muy caro.", "example_sentence_native": "یہ بہت مہنگا ہے۔", "example_sentence_phonetic": "ایس موئی کارو" }
      ],
      "exercises": {
        "matching": [
          { "id": "m1", "target": "Barato", "native": "سستا" },
          { "id": "m2", "target": "Caro", "native": "مہنگا" }
        ]
      },
      "cultural_note": "سپر مارکیٹ میں قیمتیں فکسڈ ہوتی ہیں، لیکن پرانی چیزوں کی دکانوں پر بھاؤ تاؤ ہو سکتا ہے۔",
      "pronunciation_tip": "Roll the 'r' slightly in 'Barato'.",
      "progress": { "xp": 120, "streak_bonus": 10, "badge": "ESP-NUM-W4D6" }
    },
    {
      "week": 4,
      "day": 7,
      "title": "Day 28: Final Exam",
      "title_native": "دن 28: آخری امتحان",
      "theme": "Assessment",
      "path": "numbers",
      "targetLanguage": "Spanish",
      "nativeLanguage": "Urdu",
      "words": [
        { "id": "f1", "target": "¡Felicidades!", "phonetic": "فیلیسی دادیس", "native_meaning": "مبارک ہو!", "english": "Congratulations!", "example_sentence_target": "¡Felicidades por terminar!", "example_sentence_native": "ختم کرنے پر مبارک ہو!", "example_sentence_phonetic": "فیلیسی دادیس پور ترمینار" }
      ],
      "exercises": {
        "matching": [
          { "id": "m1", "target": "Mil", "native": "1000" },
          { "id": "m2", "target": "Euro", "native": "یورو" },
          { "id": "m3", "target": "Lunes", "native": "پیر" },
          { "id": "m4", "target": "Son las dos", "native": "2 بجے ہیں" }
        ]
      },
      "cultural_note": "آپ نے ہسپانوی اعداد اور وقت کا کورس مکمل کر لیا ہے! اب آپ باہر جا کر اعتماد سے خریداری کر سکتے ہیں۔",
      "pronunciation_tip": "Celebrate by saying '¡Lo logré!' (میں نے کر لیا!)",
      "progress": { "xp": 200, "streak_bonus": 50, "badge": "ESP-NUM-COMPLETE" }
    }
  ]
}
