{
  "week": 1,
  "path": "alphabet",
  "targetLanguage": "Portuguese",
  "nativeLanguage": "Bengali",
  "days": [
    { "week": 1, "day": 1, "title": "Placeholder", "title_native": "Placeholder", "theme": "Placeholder", "path": "alphabet", "targetLanguage": "Portuguese", "nativeLanguage": "Bengali", "words": [{"id": "w1", "target": "A", "phonetic": "a", "native_meaning": "A", "english": "A", "example_sentence_target": "Placeholder", "example_sentence_native": "Placeholder", "example_sentence_phonetic": "Placeholder"}], "dialogues": [], "exercises": {}, "cultural_note": "Placeholder", "pronunciation_tip": "Placeholder", "progress": {"xp": 0, "streak_bonus": 0, "badge": ""} },
    { "week": 1, "day": 2, "title": "Placeholder", "title_native": "Placeholder", "theme": "Placeholder", "path": "alphabet", "targetLanguage": "Portuguese", "nativeLanguage": "Bengali", "words": [{"id": "w2", "target": "B", "phonetic": "be", "native_meaning": "B", "english": "B", "example_sentence_target": "Placeholder", "example_sentence_native": "Placeholder", "example_sentence_phonetic": "Placeholder"}], "dialogues": [], "exercises": {}, "cultural_note": "Placeholder", "pronunciation_tip": "Placeholder", "progress": {"xp": 0, "streak_bonus": 0, "badge": ""} },
    { "week": 1, "day": 3, "title": "Placeholder", "title_native": "Placeholder", "theme": "Placeholder", "path": "alphabet", "targetLanguage": "Portuguese", "nativeLanguage": "Bengali", "words": [{"id": "w3", "target": "C", "phonetic": "se", "native_meaning": "C", "english": "C", "example_sentence_target": "Placeholder", "example_sentence_native": "Placeholder", "example_sentence_phonetic": "Placeholder"}], "dialogues": [], "exercises": {}, "cultural_note": "Placeholder", "pronunciation_tip": "Placeholder", "progress": {"xp": 0, "streak_bonus": 0, "badge": ""} },
    { "week": 1, "day": 4, "title": "Placeholder", "title_native": "Placeholder", "theme": "Placeholder", "path": "alphabet", "targetLanguage": "Portuguese", "nativeLanguage": "Bengali", "words": [{"id": "w4", "target": "D", "phonetic": "de", "native_meaning": "D", "english": "D", "example_sentence_target": "Placeholder", "example_sentence_native": "Placeholder", "example_sentence_phonetic": "Placeholder"}], "dialogues": [], "exercises": {}, "cultural_note": "Placeholder", "pronunciation_tip": "Placeholder", "progress": {"xp": 0, "streak_bonus": 0, "badge": ""} },
    { "week": 1, "day": 5, "title": "Placeholder", "title_native": "Placeholder", "theme": "Placeholder", "path": "alphabet", "targetLanguage": "Portuguese", "nativeLanguage": "Bengali", "words": [{"id": "w5", "target": "E", "phonetic": "e", "native_meaning": "E", "english": "E", "example_sentence_target": "Placeholder", "example_sentence_native": "Placeholder", "example_sentence_phonetic": "Placeholder"}], "dialogues": [], "exercises": {}, "cultural_note": "Placeholder", "pronunciation_tip": "Placeholder", "progress": {"xp": 0, "streak_bonus": 0, "badge": ""} },
    { "week": 1, "day": 6, "title": "Placeholder", "title_native": "Placeholder", "theme": "Placeholder", "path": "alphabet", "targetLanguage": "Portuguese", "nativeLanguage": "Bengali", "words": [{"id": "w6", "target": "F", "phonetic": "efe", "native_meaning": "F", "english": "F", "example_sentence_target": "Placeholder", "example_sentence_native": "Placeholder", "example_sentence_phonetic": "Placeholder"}], "dialogues": [], "exercises": {}, "cultural_note": "Placeholder", "pronunciation_tip": "Placeholder", "progress": {"xp": 0, "streak_bonus": 0, "badge": ""} },
    { "week": 1, "day": 7, "title": "Placeholder", "title_native": "Placeholder", "theme": "Placeholder", "path": "alphabet", "targetLanguage": "Portuguese", "nativeLanguage": "Bengali", "words": [{"id": "w7", "target": "G", "phonetic": "ge", "native_meaning": "G", "english": "G", "example_sentence_target": "Placeholder", "example_sentence_native": "Placeholder", "example_sentence_phonetic": "Placeholder"}], "dialogues": [], "exercises": {}, "cultural_note": "Placeholder", "pronunciation_tip": "Placeholder", "progress": {"xp": 0, "streak_bonus": 0, "badge": ""} }
  ]
}