
{
  "week": 2,
  "path": "alphabet",
  "targetLanguage": "Arabic",
  "nativeLanguage": "Nepali",
  "days": [
    {
      "week": 2,
      "day": 1,
      "letter": "د",
      "title": "Day 8: Dal",
      "title_native": "आठौं दिन: दाल (Dal)",
      "theme": "The Letter Dal",
      "path": "alphabet",
      "targetLanguage": "Arabic",
      "nativeLanguage": "Nepali",
      "words": [
        {
          "id": "a2_1_1",
          "target": "دجاج",
          "phonetic": "दजाज",
          "native_meaning": "कुखुरा",
          "english": "Chicken",
          "example_sentence_target": "هذا دجاج.",
          "example_sentence_native": "यो कुखुरा हो।",
          "example_sentence_phonetic": "हादा दजाज।"
        }
      ],
      "exercises": {
        "writingPractice": [
          {
            "id": "w2_1_1",
            "letter": "د",
            "hint": "दाल (Dal) - एउटा सानो कोण जस्तो आकार।"
          }
        ]
      },
      "pronunciation_tip": "Dal को आवाज नेपालीको 'द' जस्तै हुन्छ।",
      "cultural_note": "अरबीमा केही अक्षरहरू आफ्ना पछाडिका अक्षरहरूसँग जोडिँदैनन्।",
      "progress": { "xp": 50, "streak_bonus": 10, "badge": "W2D1-Dal" }
    },
    {
      "week": 2,
      "day": 2,
      "letter": "ذ",
      "title": "Day 9: Thal",
      "title_native": "नौं दिन: धाल (Thal)",
      "theme": "The Letter Thal",
      "path": "alphabet",
      "targetLanguage": "Arabic",
      "nativeLanguage": "Nepali",
      "words": [
        {
          "id": "a2_2_1",
          "target": "ذهب",
          "phonetic": "दहब",
          "native_meaning": "सुन",
          "english": "Gold",
          "example_sentence_target": "هذا ذهب.",
          "example_sentence_native": "यो सुन हो।",
          "example_sentence_phonetic": "हादा दहब।"
        }
      ],
      "exercises": {
        "writingPractice": [
          {
            "id": "w2_2_1",
            "letter": "ذ",
            "hint": "धाल (Thal) - दाल जस्तै आकार तर माथि एउटा थोप्लो।"
          }
        ]
      },
      "pronunciation_tip": "Thal को आवाज निकाल्दा जिब्रोलाई दाँतको बीचमा राखेर 'ध' जस्तो आवाज निकाल्नुहोस्।",
      "cultural_note": "अरब संस्कृतिमा सुन धेरै महत्त्वपूर्ण मानिन्छ।",
      "progress": { "xp": 50, "streak_bonus": 10, "badge": "W2D2-Thal" }
    },
    {
      "week": 2,
      "day": 3,
      "letter": "ر",
      "title": "Day 10: Ra",
      "title_native": "दशौं दिन: रा (Ra)",
      "theme": "The Letter Ra",
      "path": "alphabet",
      "targetLanguage": "Arabic",
      "nativeLanguage": "Nepali",
      "words": [
        {
          "id": "a2_3_1",
          "target": "رجل",
          "phonetic": "रजुल",
          "native_meaning": "मान्छे",
          "english": "Man",
          "example_sentence_target": "هذا رجل.",
          "example_sentence_native": "यो मान्छे हो।",
          "example_sentence_phonetic": "हादा रजुल।"
        }
      ],
      "exercises": {
        "writingPractice": [
          {
            "id": "w2_3_1",
            "letter": "ر",
            "hint": "रा (Ra) - एउटा सानो चिप्लेटी जस्तो आकार।"
          }
        ]
      },
      "pronunciation_tip": "Ra को आवाज नेपालीको 'र' जस्तै हुन्छ।",
      "cultural_note": "Ra पनि आफ्ना पछाडिका अक्षरहरूसँग जोडिँदैन।",
      "progress": { "xp": 50, "streak_bonus": 10, "badge": "W2D3-Ra" }
    },
    {
      "week": 2,
      "day": 4,
      "letter": "ز",
      "title": "Day 11: Zain",
      "title_native": "एघारौं दिन: जैन (Zain)",
      "theme": "The Letter Zain",
      "path": "alphabet",
      "targetLanguage": "Arabic",
      "nativeLanguage": "Nepali",
      "words": [
        {
          "id": "a2_4_1",
          "target": "زيتون",
          "phonetic": "जैतून",
          "native_meaning": "जैतून",
          "english": "Olive",
          "example_sentence_target": "هذا زيتون.",
          "example_sentence_native": "यो जैतून हो।",
          "example_sentence_phonetic": "हादा जैतून।"
        }
      ],
      "exercises": {
        "writingPractice": [
          {
            "id": "w2_4_1",
            "letter": "ز",
            "hint": "जैन (Zain) - रा जस्तै आकार तर माथि एउटा थोप्लो।"
          }
        ]
      },
      "pronunciation_tip": "Zain को आवाज अंग्रेजीको 'Z' जस्तै हुन्छ।",
      "cultural_note": "जैतून अरब देशहरूमा धेरै खाइन्छ।",
      "progress": { "xp": 50, "streak_bonus": 10, "badge": "W2D4-Zain" }
    },
    {
      "week": 2,
      "day": 5,
      "letter": "س",
      "title": "Day 12: Seen",
      "title_native": "बाह्रौं दिन: सीन (Seen)",
      "theme": "The Letter Seen",
      "path": "alphabet",
      "targetLanguage": "Arabic",
      "nativeLanguage": "Nepali",
      "words": [
        {
          "id": "a2_5_1",
          "target": "سيارة",
          "phonetic": "सैयारा",
          "native_meaning": "गाडी",
          "english": "Car",
          "example_sentence_target": "هذه سيارة.",
          "example_sentence_native": "यो गाडी हो।",
          "example_sentence_phonetic": "हादिही सैयारा।"
        }
      ],
      "exercises": {
        "writingPractice": [
          {
            "id": "w2_5_1",
            "letter": "س",
            "hint": "सीन (Seen) - दुईवटा साना दाँत र एउटा ठूलो गोलाइ।"
          }
        ]
      },
      "pronunciation_tip": "Seen को आवाज नेपालीको 'स' जस्तै हुन्छ।",
      "cultural_note": "अरबी शब्दहरूमा लिङ्ग (स्त्रीलिङ्ग/पुल्लिङ्ग) महत्त्वपूर्ण हुन्छ।",
      "progress": { "xp": 50, "streak_bonus": 10, "badge": "W2D5-Seen" }
    },
    {
      "week": 2,
      "day": 6,
      "letter": "ش",
      "title": "Day 13: Sheen",
      "title_native": "तेह्रौं दिन: शीन (Sheen)",
      "theme": "The Letter Sheen",
      "path": "alphabet",
      "targetLanguage": "Arabic",
      "nativeLanguage": "Nepali",
      "words": [
        {
          "id": "a2_6_1",
          "target": "شمس",
          "phonetic": "शम्स",
          "native_meaning": "घाम",
          "english": "Sun",
          "example_sentence_target": "هذه شمس.",
          "example_sentence_native": "यो घाम हो।",
          "example_sentence_phonetic": "हादिही शम्स।"
        }
      ],
      "exercises": {
        "writingPractice": [
          {
            "id": "w2_6_1",
            "letter": "ش",
            "hint": "शीन (Sheen) - सीन जस्तै आकार तर माथि तीनवटा थोप्ला।"
          }
        ]
      },
      "pronunciation_tip": "Sheen को आवाज नेपालीको 'श' जस्तै हुन्छ।",
      "cultural_note": "घाम अरब देशहरूको जीवनको एक प्रमुख हिस्सा हो।",
      "progress": { "xp": 50, "streak_bonus": 10, "badge": "W2D6-Sheen" }
    },
    {
      "week": 2,
      "day": 7,
      "letter": "ص",
      "title": "Day 14: Saad",
      "title_native": "चौधौं दिन: साद (Saad)",
      "theme": "The Letter Saad",
      "path": "alphabet",
      "targetLanguage": "Arabic",
      "nativeLanguage": "Nepali",
      "words": [
        {
          "id": "a2_7_1",
          "target": "صقر",
          "phonetic": "सकर",
          "native_meaning": "बाज",
          "english": "Falcon",
          "example_sentence_target": "هذا صقر.",
          "example_sentence_native": "यो बाज हो।",
          "example_sentence_phonetic": "हादा सकर।"
        }
      ],
      "exercises": {
        "writingPractice": [
          {
            "id": "w2_7_1",
            "letter": "ص",
            "hint": "साद (Saad) - एउटा अन्डाकार भाग र एउटा ठूलो गोलाइ।"
          }
        ]
      },
      "pronunciation_tip": "यो 'स' नेपालीको 'स' भन्दा अलि मोटो र भारी हुन्छ।",
      "cultural_note": "बाज (Falcon) अरब संस्कृति र खेलकुदमा धेरै प्रसिद्ध छ।",
      "progress": { "xp": 100, "streak_bonus": 20, "badge": "W2-Alphabet-Advancer" }
    }
  ]
}
