
{
  "week": 4,
  "path": "numbers",
  "targetLanguage": "Chinese",
  "nativeLanguage": "Nepali",
  "days": [
    {
      "week": 4,
      "day": 1,
      "title": "Day 22: Money (Yuan)",
      "title_native": "पैसा (युआन)",
      "theme": "Money",
      "path": "numbers",
      "targetLanguage": "Chinese",
      "nativeLanguage": "Nepali",
      "words": [
        { "id": "n4_1_1", "target": "元 (yuán)", "phonetic": "युआन", "native_meaning": "युआन (मुद्रा)", "english": "Yuan", "example_sentence_target": "一百元。", "example_sentence_native": "एक सय युआन।", "example_sentence_phonetic": "ई पाइ युआन।" },
        { "id": "n4_1_2", "target": "块 (kuài)", "phonetic": "क्वाई", "native_meaning": "युआन (बोलिचालीमा)", "english": "Buck/Yuan", "example_sentence_target": "五块钱。", "example_sentence_native": "पाँच युआन।", "example_sentence_phonetic": "ऊ क्वाई छियान।" }
      ],
      "exercises": {
        "matching": [
          { "id": "m4_1_1", "target": "十块", "native": "दश युआन" },
          { "id": "m4_1_2", "target": "五十块", "native": "पचास युआन" }
        ]
      },
      "cultural_note": "पसलमा सामान किन्दा धेरैजसो मानिसले 'क्वाई' (kuài) शब्द प्रयोग गर्छन्।",
      "pronunciation_tip": "'क्वाई' भन्दा 'क' र 'व' लाई जोडेर भन्नुहोस्।",
      "progress": { "xp": 100, "streak_bonus": 10, "badge": "N4D1-Money" }
    },
    {
      "week": 4,
      "day": 2,
      "title": "Day 23: How Much?",
      "title_native": "कति पैसा?",
      "theme": "Money",
      "path": "numbers",
      "targetLanguage": "Chinese",
      "nativeLanguage": "Nepali",
      "words": [
        { "id": "n4_2_1", "target": "多少钱？ (duōshǎo qián?)", "phonetic": "तुओ साओ छियान?", "native_meaning": "कति पैसा हो?", "english": "How much money?", "example_sentence_target": "这个多少钱？", "example_sentence_native": "यसको कति पैसा हो?", "example_sentence_phonetic": "च ग तुओ साओ छियान?" },
        { "id": "n4_2_2", "target": "贵 (guì)", "phonetic": "कुई", "native_meaning": "महँगो", "english": "Expensive", "example_sentence_target": "太贵了！", "example_sentence_native": "धेरै महँगो भयो!", "example_sentence_phonetic": "थाई कुई ल!" }
      ],
      "exercises": {
        "fillBlanks": [
          { "id": "fb4_2_1", "sentence": "कति पैसा भन्नका लागि '___ छियान' भनिन्छ।", "answer": "多少", "hint": "तुओ साओ" }
        ]
      },
      "cultural_note": "चीनमा ससाना पसलहरूमा पैसाको मोलमोलाई (bargaining) गर्ने चलन छ।",
      "pronunciation_tip": "'छियान' (qián) भन्दा नेपाली 'छ' जस्तै उच्चारण गर्नुहोस्।",
      "progress": { "xp": 100, "streak_bonus": 10, "badge": "N4D2-Price" }
    },
    {
      "week": 4,
      "day": 3,
      "title": "Day 24: Telling Time (Hours)",
      "title_native": "समय भन्नु (घण्टा)",
      "theme": "Time",
      "path": "numbers",
      "targetLanguage": "Chinese",
      "nativeLanguage": "Nepali",
      "words": [
        { "id": "n4_3_1", "target": "点 (diǎn)", "phonetic": "डियान", "native_meaning": "बज्यो", "english": "O'clock", "example_sentence_target": "现在几点？", "example_sentence_native": "अहिले कति बज्यो?", "example_sentence_phonetic": "सियन चाई ची डियान?" },
        { "id": "n4_3_2", "target": "两点 (liǎngdiǎn)", "phonetic": "ल्याङ्ग डियान", "native_meaning": "दुई बज्यो", "english": "Two o'clock", "example_sentence_target": "现在两点。", "example_sentence_native": "अहिले दुई बज्यो।", "example_sentence_phonetic": "सियन चाई ल्याङ्ग डियान।" }
      ],
      "exercises": {
        "matching": [
          { "id": "m4_3_1", "target": "八点", "native": "आठ बज्यो" },
          { "id": "m4_3_2", "target": "十二点", "native": "बाह्र बज्यो" }
        ]
      },
      "cultural_note": "दुई बज्यो भन्दा खेरि सधैं 'ल्याङ्ग डियान' भन्नुहोस्, 'आर डियान' भन्नु गलत हुन्छ।",
      "pronunciation_tip": "'डियान' को 'द' लाई अलि 'त' र 'द' को बीचको जस्तै भन्नुहोस्।",
      "progress": { "xp": 100, "streak_bonus": 10, "badge": "N4D3-Hours" }
    },
    {
      "week": 4,
      "day": 4,
      "title": "Day 25: Minutes and Half Hours",
      "title_native": "मिनेट र साढे",
      "theme": "Time",
      "path": "numbers",
      "targetLanguage": "Chinese",
      "nativeLanguage": "Nepali",
      "words": [
        { "id": "n4_4_1", "target": "分 (fēn)", "phonetic": "फन", "native_meaning": "मिनेट", "english": "Minutes", "example_sentence_target": "五点十分。", "example_sentence_native": "पाँच बजेर दश मिनेट।", "example_sentence_phonetic": "ऊ डियान शी फन।" },
        { "id": "n4_4_2", "target": "半 (bàn)", "phonetic": "पान", "native_meaning": "साढे / आधा", "english": "Half", "example_sentence_target": "三点半。", "example_sentence_native": "साढे तीन बज्यो।", "example_sentence_phonetic": "सान डियान पान।" }
      ],
      "exercises": {
        "multipleChoice": [
          { "id": "mc4_4_1", "question": "साढे सात बज्यो भन्न कुन शब्द सही छ?", "options": ["छी डियान सान-शी", "छी डियान पान", "छी डियान", "पा डियान पान"], "correct": 1, "explanation": "'छी डियान पान' को अर्थ साढे सात हो।" }
        ]
      },
      "cultural_note": "चिनियाँ भाषामा 'पान' (bàn) को अर्थ आधा हो।",
      "pronunciation_tip": "'फन' भन्दा 'फ' को आवाज स्पष्टसँग निकाल्नुहोस्।",
      "progress": { "xp": 100, "streak_bonus": 10, "badge": "N4D4-Minutes" }
    },
    {
      "week": 4,
      "day": 5,
      "title": "Day 26: Morning and Evening",
      "title_native": "बिहान र साँझ",
      "theme": "Time",
      "path": "numbers",
      "targetLanguage": "Chinese",
      "nativeLanguage": "Nepali",
      "words": [
        { "id": "n4_5_1", "target": "上午 (shàngwǔ)", "phonetic": "साङ्ग-ऊ", "native_meaning": "बिहान", "english": "Morning", "example_sentence_target": "上午九点。", "example_sentence_native": "बिहानको नौ बज्यो।", "example_sentence_phonetic": "साङ्ग-ऊ चिउ डियान।" },
        { "id": "n4_5_2", "target": "下午 (xiàwǔ)", "phonetic": "सिया-ऊ", "native_meaning": "दिउँसो / साँझ", "english": "Afternoon", "example_sentence_target": "下午三点。", "example_sentence_native": "दिउँसोको तीन बज्यो।", "example_sentence_phonetic": "सिया-ऊ सान डियान।" }
      ],
      "exercises": {
        "sentenceScramble": [
          { "id": "ss4_5_1", "scrambled": ["下午", "点", "五"], "correct": "下午五点", "nativeHint": "बेलुका ५ बज्यो" }
        ]
      },
      "cultural_note": "चिनियाँ क्यालेन्डरमा AM र PM को सट्टा बिहान र दिउँसो भन्ने शब्दहरू समयको अगाडि राखिन्छन्।",
      "pronunciation_tip": "'साङ्ग' भन्दा अलि पछाडिबाट आवाज निकाल्नुहोस्।",
      "progress": { "xp": 120, "streak_bonus": 15, "badge": "N4D5-TimeOfDay" }
    },
    {
      "week": 4,
      "day": 6,
      "title": "Day 27: Shopping Phrases",
      "title_native": "किनमेलका वाक्यहरू",
      "theme": "Practical",
      "path": "numbers",
      "targetLanguage": "Chinese",
      "nativeLanguage": "Nepali",
      "words": [
        { "id": "n4_6_1", "target": "便宜一点 (piányi yīdiǎn)", "phonetic": "छियान-यी ई-तियान", "native_meaning": "अलि सस्तो गर्नुहोस्", "english": "A bit cheaper", "example_sentence_target": "可以便宜一点吗？", "example_sentence_native": "के अलि सस्तो गर्न सकिन्छ?", "example_sentence_phonetic": "ख-यी छियान-यी ई-तियान मा?" },
        { "id": "n4_6_2", "target": "买 (mǎi)", "phonetic": "माई", "native_meaning": "किन्नु", "english": "Buy", "example_sentence_target": "我要买这个。", "example_sentence_native": "म यो किन्न चाहन्छु।", "example_sentence_phonetic": "वो याओ माई च ग।" }
      ],
      "exercises": {
        "matching": [
          { "id": "m4_6_1", "target": "便宜", "native": "सस्तो" },
          { "id": "m4_6_2", "target": "贵", "native": "महँगो" }
        ]
      },
      "cultural_note": "पसलमा 'सस्तो गर्नुहोस्' भन्नु चीनमा सामान्य कुरा हो।",
      "pronunciation_tip": "'माई' (mǎi - किन्नु) भन्दा घाँटीबाट आवाज अलि तल लगेर माथि ल्याउनुहोस् (थर्ड टोन)।",
      "progress": { "xp": 100, "streak_bonus": 10, "badge": "N4D6-Shop" }
    },
    {
      "week": 4,
      "day": 7,
      "title": "Day 28: Final Review",
      "title_native": "अन्तिम पुनरावृत्ति",
      "theme": "Review",
      "path": "numbers",
      "targetLanguage": "Chinese",
      "nativeLanguage": "Nepali",
      "words": [
        { "id": "n4_7_1", "target": "全部 (quánbù)", "phonetic": "छ्वान-पु", "native_meaning": "सबै / पूर्ण", "english": "All", "example_sentence_target": "我学会了数字。", "example_sentence_native": "मैले अंकहरू सिकें।", "example_sentence_phonetic": "वो सुए-हुई ल सु-जी।" }
      ],
      "exercises": {
        "matching": [
          { "id": "m4_7_1", "target": "多少钱？", "native": "कति पैसा हो?" },
          { "id": "m4_7_2", "target": "现在几点？", "native": "अहिले कति बज्यो?" },
          { "id": "m4_7_3", "target": "一百块", "native": "एक सय युआन" }
        ]
      },
      "cultural_note": "बधाई छ! तपाईंले चिनियाँ अंकहरू, समय र पैसाको बारेमा धेरै कुरा सिक्नुभयो।",
      "pronunciation_tip": "चिनियाँ टोनहरू सधैं अभ्यास गरिरहनुहोस्, यो धेरै महत्त्वपूर्ण छ।",
      "progress": { "xp": 200, "streak_bonus": 30, "badge": "N4-Graduate" }
    }
  ]
}
