
{
  "week": 3,
  "path": "numbers",
  "targetLanguage": "Japanese",
  "nativeLanguage": "Urdu",
  "days": [
    {
      "week": 3,
      "day": 1,
      "title": "Thousands and Ten Thousands",
      "title_native": "ہزاروں اور دس ہزار",
      "theme": "High Value Numbers",
      "path": "numbers",
      "targetLanguage": "Japanese",
      "nativeLanguage": "Urdu",
      "words": [
        {
          "id": "ujn_3_1_1",
          "target": "Sen",
          "phonetic": "سین",
          "native_meaning": "ہزار",
          "english": "One thousand",
          "example_sentence_target": "Sen-en desu.",
          "example_sentence_native": "یہ ایک ہزار ین ہے۔",
          "example_sentence_phonetic": "سین این دیس"
        },
        {
          "id": "ujn_3_1_2",
          "target": "Man",
          "phonetic": "مان",
          "native_meaning": "دس ہزار",
          "english": "Ten thousand",
          "example_sentence_target": "Ichi-man-en desu.",
          "example_sentence_native": "یہ دس ہزار ین ہے۔",
          "example_sentence_phonetic": "اِچی مان این دیس"
        }
      ],
      "exercises": {
        "matching": [
          { "id": "m1", "target": "Sen", "native": "ہزار" },
          { "id": "m2", "target": "Man", "native": "دس ہزار" }
        ]
      },
      "cultural_note": "جاپانی معیشت میں 'مان' (10,000) کی بہت اہمیت ہے۔ بینک اور تنخواہ اسی حساب سے بتائی جاتی ہے۔",
      "pronunciation_tip": "سین اور مان دونوں میں نون غنہ جیسی آواز نہیں بلکہ واضح 'ن' ہے۔",
      "progress": { "xp": 70, "streak_bonus": 10, "badge": "UJ-N3-1" }
    },
    {
      "week": 3,
      "day": 2,
      "title": "Combining Large Numbers",
      "title_native": "بڑے نمبروں کو جوڑنا",
      "theme": "Complex Counting",
      "path": "numbers",
      "targetLanguage": "Japanese",
      "nativeLanguage": "Urdu",
      "words": [
        {
          "id": "ujn_3_2_1",
          "target": "Ni-sen",
          "phonetic": "نی سین",
          "native_meaning": "دو ہزار",
          "english": "Two thousand",
          "example_sentence_target": "Ni-sen desu.",
          "example_sentence_native": "یہ دو ہزار ہے۔",
          "example_sentence_phonetic": "نی سین دیس"
        }
      ],
      "exercises": {
        "fillBlanks": [
          { "id": "f1", "sentence": "2000 is ___", "answer": "Ni-sen", "hint": "نی سین" }
        ]
      },
      "cultural_note": "جاپان میں 2000 کا نوٹ نایاب ہے لیکن موجود ہے۔",
      "pronunciation_tip": "تین ہزار کے لیے 'سان زین' بولا جاتا ہے (سین کی جگہ زین)۔",
      "progress": { "xp": 70, "streak_bonus": 10, "badge": "UJ-N3-2" }
    },
    {
      "week": 3,
      "day": 3,
      "title": "Months: 1 to 4",
      "title_native": "مہینے: پہلا سے چوتھا",
      "theme": "Quarter 1",
      "path": "numbers",
      "targetLanguage": "Japanese",
      "nativeLanguage": "Urdu",
      "words": [
        {
          "id": "ujn_3_3_1",
          "target": "Ichi-gatsu",
          "phonetic": "اِچی گاتسو",
          "native_meaning": "جنوری",
          "english": "January",
          "example_sentence_target": "Ichi-gatsu desu.",
          "example_sentence_native": "جنوری کا مہینہ ہے۔",
          "example_sentence_phonetic": "اِچی گاتسو دیس"
        },
        {
          "id": "ujn_3_3_2",
          "target": "Shi-gatsu",
          "phonetic": "شی گاتسو",
          "native_meaning": "اپریل",
          "english": "April",
          "example_sentence_target": "Shi-gatsu desu.",
          "example_sentence_native": "اپریل کا مہینہ ہے۔",
          "example_sentence_phonetic": "شی گاتسو دیس"
        }
      ],
      "exercises": {
        "matching": [
          { "id": "m1", "target": "Ichi-gatsu", "native": "جنوری" },
          { "id": "m2", "target": "Ni-gatsu", "native": "فروری" },
          { "id": "m3", "target": "Shi-gatsu", "native": "اپریل" }
        ]
      },
      "cultural_note": "جاپانی مہینوں کے نام نمبروں کے ساتھ 'Gatsu' لگا کر بنتے ہیں۔",
      "pronunciation_tip": "اپریل کے لیے صرف 'شی گاتسو' بولا جاتا ہے، 'یون گاتسو' نہیں۔",
      "progress": { "xp": 70, "streak_bonus": 10, "badge": "UJ-N3-3" }
    },
    {
      "week": 3,
      "day": 4,
      "title": "Months: 5 to 8",
      "title_native": "مہینے: پانچواں سے آٹھواں",
      "theme": "Summer Months",
      "path": "numbers",
      "targetLanguage": "Japanese",
      "nativeLanguage": "Urdu",
      "words": [
        {
          "id": "ujn_3_4_1",
          "target": "Go-gatsu",
          "phonetic": "گو گاتسو",
          "native_meaning": "مئی",
          "english": "May",
          "example_sentence_target": "Go-gatsu desu.",
          "example_sentence_native": "مئی کا مہینہ ہے۔",
          "example_sentence_phonetic": "گو گاتسو دیس"
        },
        {
          "id": "ujn_3_4_2",
          "target": "Hachi-gatsu",
          "phonetic": "ہاچی گاتسو",
          "native_meaning": "اگست",
          "english": "August",
          "example_sentence_target": "Hachi-gatsu desu.",
          "example_sentence_native": "اگست کا مہینہ ہے۔",
          "example_sentence_phonetic": "ہاچی گاتسو دیس"
        }
      ],
      "exercises": {
        "matching": [
          { "id": "m1", "target": "Go-gatsu", "native": "مئی" },
          { "id": "m2", "target": "Hachi-gatsu", "native": "اگست" }
        ]
      },
      "cultural_note": "آٹھواں مہینہ (اگست) جاپان میں گرمیوں کی چھٹیوں کا وقت ہوتا ہے۔",
      "pronunciation_tip": "گاتسو میں 'سو' کی آواز بہت ہلکی رکھی جاتی ہے۔",
      "progress": { "xp": 70, "streak_bonus": 10, "badge": "UJ-N3-4" }
    },
    {
      "week": 3,
      "day": 5,
      "title": "Months: 9 to 12",
      "title_native": "مہینے: نو سے بارہ",
      "theme": "Year End",
      "path": "numbers",
      "targetLanguage": "Japanese",
      "nativeLanguage": "Urdu",
      "words": [
        {
          "id": "ujn_3_5_1",
          "target": "Ku-gatsu",
          "phonetic": "کو گاتسو",
          "native_meaning": "ستمبر",
          "english": "September",
          "example_sentence_target": "Ku-gatsu desu.",
          "example_sentence_native": "ستمبر کا مہینہ ہے۔",
          "example_sentence_phonetic": "کو گاتسو دیس"
        },
        {
          "id": "ujn_3_5_2",
          "target": "Juu-ni-gatsu",
          "phonetic": "جو نی گاتسو",
          "native_meaning": "دسمبر",
          "english": "December",
          "example_sentence_target": "Juu-ni-gatsu desu.",
          "example_sentence_native": "دسمبر کا مہینہ ہے۔",
          "example_sentence_phonetic": "جو نی گاتسو دیس"
        }
      ],
      "exercises": {
        "matching": [
          { "id": "m1", "target": "Ku-gatsu", "native": "ستمبر" },
          { "id": "m2", "target": "Juu-ni-gatsu", "native": "دسمبر" }
        ]
      },
      "cultural_note": "ستمبر کے لیے 'کو گاتسو' بولا جاتا ہے، 'کیو گاتسو' نہیں۔",
      "pronunciation_tip": "جو-نی-گاتسو کو تیزی سے بولیں۔",
      "progress": { "xp": 70, "streak_bonus": 10, "badge": "UJ-N3-5" }
    },
    {
      "week": 3,
      "day": 6,
      "title": "Review Large Numbers & Months",
      "title_native": "دہرائی: بڑی گنتی اور مہینے",
      "theme": "Review",
      "path": "numbers",
      "targetLanguage": "Japanese",
      "nativeLanguage": "Urdu",
      "words": [
        {
          "id": "ujn_3_6_1",
          "target": "Nan-gatsu?",
          "phonetic": "نان گاتسو",
          "native_meaning": "کونسا مہینہ؟",
          "english": "What month?",
          "example_sentence_target": "Nan-gatsu desu ka?",
          "example_sentence_native": "کونسا مہینہ ہے؟",
          "example_sentence_phonetic": "نان گاتسو دیس کا"
        }
      ],
      "exercises": {
        "fillBlanks": [
          { "id": "f1", "sentence": "December is ___", "answer": "Juu-ni-gatsu", "hint": "12" }
        ]
      },
      "cultural_note": "جاپان میں نئے سال کا آغاز جنوری میں ہوتا ہے۔",
      "pronunciation_tip": "نان (Nan) کا مطلب 'کیا' یا 'کونسا' ہے۔",
      "progress": { "xp": 70, "streak_bonus": 10, "badge": "UJ-N3-6" }
    },
    {
      "week": 3,
      "day": 7,
      "title": "Week 3 Final Test",
      "title_native": "تیسرے ہفتے کا امتحان",
      "theme": "Test",
      "path": "numbers",
      "targetLanguage": "Japanese",
      "nativeLanguage": "Urdu",
      "words": [
        {
          "id": "ujn_3_7_1",
          "target": "Itsu?",
          "phonetic": "اِتسو",
          "native_meaning": "کب؟",
          "english": "When?",
          "example_sentence_target": "Itsu desu ka?",
          "example_sentence_native": "یہ کب ہے؟",
          "example_sentence_phonetic": "اِتسو دیس کا"
        }
      ],
      "exercises": {
        "matching": [
          { "id": "m1", "target": "Sen", "native": "ہزار" },
          { "id": "m2", "target": "Man", "native": "دس ہزار" },
          { "id": "m3", "target": "Ichi-gatsu", "native": "جنوری" },
          { "id": "m4", "target": "Shi-gatsu", "native": "اپریل" }
        ]
      },
      "cultural_note": "جاپان میں سال کا آغاز اکثر اپریل میں ہوتا ہے (سکول اور دفاتر)۔",
      "pronunciation_tip": "اِتسو میں 'ت' کی آواز مختصر ہے۔",
      "progress": { "xp": 100, "streak_bonus": 20, "badge": "UJ-N3-FIN" }
    }
  ]
}
