{
  "week": 1,
  "path": "numbers",
  "targetLanguage": "Romanian",
  "nativeLanguage": "Hindi",
  "days": [
    { "week": 1, "day": 1, "title": "Day 1: Placeholder", "title_native": "Placeholder", "theme": "Placeholder", "path": "numbers", "targetLanguage": "Romanian", "nativeLanguage": "Hindi", "words": [{"id": "w1_1_1", "target": "Placeholder", "phonetic": "Placeholder", "native_meaning": "Placeholder", "english": "Placeholder", "example_sentence_target": "Placeholder.", "example_sentence_native": "Placeholder.", "example_sentence_phonetic": "Placeholder."}], "dialogues": [], "exercises": {}, "cultural_note": "Placeholder", "pronunciation_tip": "Placeholder", "progress": {"xp": 0, "streak_bonus": 0, "badge": "W1D1-Placeholder"} },
    { "week": 1, "day": 2, "title": "Day 2: Placeholder", "title_native": "Placeholder", "theme": "Placeholder", "path": "numbers", "targetLanguage": "Romanian", "nativeLanguage": "Hindi", "words": [{"id": "w1_2_1", "target": "Placeholder", "phonetic": "Placeholder", "native_meaning": "Placeholder", "english": "Placeholder", "example_sentence_target": "Placeholder.", "example_sentence_native": "Placeholder.", "example_sentence_phonetic": "Placeholder."}], "dialogues": [], "exercises": {}, "cultural_note": "Placeholder", "pronunciation_tip": "Placeholder", "progress": {"xp": 0, "streak_bonus": 0, "badge": "W1D2-Placeholder"} },
    { "week": 1, "day": 3, "title": "Day 3: Placeholder", "title_native": "Placeholder", "theme": "Placeholder", "path": "numbers", "targetLanguage": "Romanian", "nativeLanguage": "Hindi", "words": [{"id": "w1_3_1", "target": "Placeholder", "phonetic": "Placeholder", "native_meaning": "Placeholder", "english": "Placeholder", "example_sentence_target": "Placeholder.", "example_sentence_native": "Placeholder.", "example_sentence_phonetic": "Placeholder."}], "dialogues": [], "exercises": {}, "cultural_note": "Placeholder", "pronunciation_tip": "Placeholder", "progress": {"xp": 0, "streak_bonus": 0, "badge": "W1D3-Placeholder"} },
    { "week": 1, "day": 4, "title": "Day 4: Placeholder", "title_native": "Placeholder", "theme": "Placeholder", "path": "numbers", "targetLanguage": "Romanian", "nativeLanguage": "Hindi", "words": [{"id": "w1_4_1", "target": "Placeholder", "phonetic": "Placeholder", "native_meaning": "Placeholder", "english": "Placeholder", "example_sentence_target": "Placeholder.", "example_sentence_native": "Placeholder.", "example_sentence_phonetic": "Placeholder."}], "dialogues": [], "exercises": {}, "cultural_note": "Placeholder", "pronunciation_tip": "Placeholder", "progress": {"xp": 0, "streak_bonus": 0, "badge": "W1D4-Placeholder"} },
    { "week": 1, "day": 5, "title": "Day 5: Placeholder", "title_native": "Placeholder", "theme": "Placeholder", "path": "numbers", "targetLanguage": "Romanian", "nativeLanguage": "Hindi", "words": [{"id": "w1_5_1", "target": "Placeholder", "phonetic": "Placeholder", "native_meaning": "Placeholder", "english": "Placeholder", "example_sentence_target": "Placeholder.", "example_sentence_native": "Placeholder.", "example_sentence_phonetic": "Placeholder."}], "dialogues": [], "exercises": {}, "cultural_note": "Placeholder", "pronunciation_tip": "Placeholder", "progress": {"xp": 0, "streak_bonus": 0, "badge": "W1D5-Placeholder"} },
    { "week": 1, "day": 6, "title": "Day 6: Placeholder", "title_native": "Placeholder", "theme": "Placeholder", "path": "numbers", "targetLanguage": "Romanian", "nativeLanguage": "Hindi", "words": [{"id": "w1_6_1", "target": "Placeholder", "phonetic": "Placeholder", "native_meaning": "Placeholder", "english": "Placeholder", "example_sentence_target": "Placeholder.", "example_sentence_native": "Placeholder.", "example_sentence_phonetic": "Placeholder."}], "dialogues": [], "exercises": {}, "cultural_note": "Placeholder", "pronunciation_tip": "Placeholder", "progress": {"xp": 0, "streak_bonus": 0, "badge": "W1D6-Placeholder"} },
    { "week": 1, "day": 7, "title": "Day 7: Placeholder", "title_native": "Placeholder", "theme": "Placeholder", "path": "numbers", "targetLanguage": "Romanian", "nativeLanguage": "Hindi", "words": [{"id": "w1_7_1", "target": "Placeholder", "phonetic": "Placeholder", "native_meaning": "Placeholder", "english": "Placeholder", "example_sentence_target": "Placeholder.", "example_sentence_native": "Placeholder.", "example_sentence_phonetic": "Placeholder."}], "dialogues": [], "exercises": {}, "cultural_note": "Placeholder", "pronunciation_tip": "Placeholder", "progress": {"xp": 0, "streak_bonus": 0, "badge": "W1D7-Placeholder"} }
  ]
}